{
  "$schema": "./assets-brief.schema.json",
  "version": 1,
  "lot": "LOT-87",
  "designResolution": [1920, 1080],
  "installRoot": "Source/Elements/Assets/UI",
  "references": "Documentation/Lot/LOT-87-charte-v2/references",
  "tokens": "Source/Ui/Theme/Tokens.qml",
  "materials": {
    "tactical": {
      "tokens": ["surface", "frameEdge", "panel", "textAlly", "textEnemy", "goldLight"],
      "prompt": "Material: painted tactical-map terrain seen from a high three-quarter angle, like the battle scene behind the HUD: trodden ochre sand and pale worn flagstones ({surface}), weathered grey-brown stone, deep shadows near {panel} and dark contours near {frameEdge}. Ally markings are cyan-blue ({textAlly}), enemy markings blood-red ({textEnemy}); the acting fighter is bright gold ({goldLight})."
    },
    "dark": {
      "tokens": ["panel", "panelRaised", "panelEdge", "goldLight", "gem", "gemLight"],
      "prompt": "Material: near-black lacquered surfaces ({panel}, raised {panelRaised}) rimmed with bright gold ({panelEdge}, highlights {goldLight}); garnet enamel accents ({gem}, lit {gemLight})."
    },
    "parchment": {
      "tokens": ["background", "surface", "surfaceAlt", "text", "accent", "border", "gem", "gemShadow"],
      "prompt": "Material: aged parchment ({surface}, shadowed {background}, light {surfaceAlt}), sepia ink ({text}), antique gold and brass ({accent}, {border}), garnet accents ({gem}, shadow {gemShadow})."
    },
    "scene": {
      "tokens": ["panel", "panelEdge", "gem"],
      "prompt": "Painted illustration, full bleed. Keep the darkest values near {panel}, the warm highlights toward {panelEdge} and any banner cloth toward {gem}, so that dark gold-rimmed panels sit naturally on top."
    },
    "neutral": {
      "tokens": [],
      "prompt": "Material: pure greyscale with alpha only, no hue whatsoever: the game tints it."
    }
  },
  "prompt": {
    "style": "Game UI asset for a painted dark-fantasy tactical RPG, in the style of a richly illustrated tabletop sourcebook: relief gold and brass filigree, worn enamel, soft light from the top left, fine painterly grain. Front orthographic view, perfectly centred and symmetrical unless stated, no perspective, no cast shadow outside the piece.",
    "noLettering": "Absolutely no lettering, letters, numbers, runes or glyphs anywhere: the game sets all text itself in {titleFamily} (titles) and {bodyFamily} (body).",
    "lettering": "The only lettering allowed is the one described below, in carved Roman capitals in the spirit of {titleFamily}; no other text.",
    "canvas": "Canvas exactly {width} x {height} px, {background}.",
    "three-slice": "Horizontal 3-slice piece: the end ornaments lie inside {left} px from the left and {right} px from the right; the section between them is uniform and repeats seamlessly along the width; the full height is kept as drawn.",
    "nine-patch": "9-patch piece: every corner ornament lies inside {left} px from the left, {right} px from the right, {top} px from the top and {bottom} px from the bottom; between them the edges are uniform and repeat seamlessly, and the centre is plain and seamlessly repeatable.",
    "fixed": "Fixed-size piece, never stretched: keep a 4 px empty margin around it.",
    "tile": "Seamlessly tileable in both directions, no visible seam, no focal feature.",
    "cover": "Full-screen background, composed for 16:9, safe to crop 10 % on either side."
  },
  "pieces": [
    {
      "key": "ui/background/menu-scene",
      "name": "Scène du menu et des crédits",
      "material": "scene",
      "size": [1920, 1080],
      "display": "cover",
      "transparent": false,
      "description": "Vallée au couchant, cité fortifiée au centre-droit, compagnie de quatre aventuriers de dos sur un promontoire à droite, étendard grenat à gauche. Le tiers gauche reste calme et sombre : la colonne du menu et le logo s'y posent.",
      "prompt": "Epic painted landscape at golden-hour sunset: a river valley with a walled castle city on a hill centre-right, misty mountains, dramatic clouds; four adventurers seen from behind on a rocky outcrop in the right third (archer, armoured warrior, fur-clad dwarf, hooded mage with a glowing staff), a campfire and lantern at the bottom right. The left third is darker and quiet, with a tall garnet war standard at the far left edge, leaving room for a menu column.",
      "mockups": [
        {
          "file": "06_Main_Menu_Mockup.png",
          "zone": [0, 0, 1672, 941],
          "shows": "scène entière, derrière le logo, le menu et le profil"
        },
        {
          "file": "07_Credit_Mockup.png",
          "zone": [0, 0, 1672, 941],
          "shows": "même scène, cadrée à droite, derrière le panneau des crédits"
        }
      ],
      "screens": ["T3.1", "T3.3"],
      "fallback": ["panel"]
    },
    {
      "key": "ui/background/options-backdrop",
      "name": "Décor flouté des options",
      "material": "scene",
      "size": [1920, 1080],
      "display": "cover",
      "transparent": false,
      "description": "Paysage de forêt et de citadelle, flou et assombri, sans point focal : il ne doit rien disputer au panneau des réglages. Peut être obtenu en floutant la scène du menu hors du jeu, tant que le résultat est déclaré sous cette clé.",
      "prompt": "Out-of-focus painted landscape of a forested valley and a distant citadel, heavy gaussian-like blur, darkened by about 40 %, low contrast, no focal point, warm dusk light.",
      "mockups": [
        {
          "file": "05_Options_Mockup.png",
          "zone": [0, 0, 1536, 1024],
          "shows": "décor derrière le panneau des options"
        }
      ],
      "screens": ["T3.2", "T3.9"],
      "fallback": ["panel"]
    },
    {
      "key": "ui/background/parchment-tile",
      "name": "Parchemin répétable",
      "material": "parchment",
      "size": [512, 512],
      "display": "tile",
      "transparent": false,
      "tileMode": {
        "horizontal": "repeat",
        "vertical": "repeat"
      },
      "description": "Champ de parchemin vieilli, taches et fibres, sans pli ni motif reconnaissable : il se répète sous les documents du personnage.",
      "prompt": "Seamless aged parchment texture: fibres, faint stains and foxing, very subtle cracks, even lighting, no folds, no burns, no drawings, no focal feature.",
      "mockups": [
        {
          "file": "03_Character_Sheet_Mockup.png",
          "zone": [1110, 880, 1470, 960],
          "shows": "champ nu sous la liste des compétences"
        },
        {
          "file": "09_MercenaryScreen_Mockup.png",
          "zone": [40, 605, 470, 640],
          "shows": "champ nu entre deux rangées de membres"
        }
      ],
      "screens": ["T3.4", "T3.5", "T3.7", "T3.8", "T3.9"],
      "fallback": ["surface"]
    },
    {
      "key": "ui/background/leather-tile",
      "name": "Cuir sombre répétable",
      "material": "parchment",
      "size": [512, 512],
      "display": "tile",
      "transparent": false,
      "tileMode": {
        "horizontal": "repeat",
        "vertical": "repeat"
      },
      "description": "Le fond sombre et usé sur lequel est posée la feuille — cuir tanné ou pierre patinée, sans relief marqué.",
      "prompt": "Seamless dark worn leather texture, deep brown-black with grey scuffs, soft grain, even lighting, no stitching, no emboss, no focal feature.",
      "mockups": [
        {
          "file": "03_Character_Sheet_Mockup.png",
          "zone": [0, 1000, 1536, 1024],
          "shows": "bande sombre sous la feuille"
        },
        {
          "file": "10_Skills_Mockup.png",
          "zone": [0, 922, 1672, 941],
          "shows": "bande sombre sous la feuille"
        }
      ],
      "screens": ["T3.4", "T3.5", "T3.7", "T3.8"],
      "fallback": ["background"]
    },
    {
      "key": "ui/frame/panel-dark",
      "name": "Panneau sombre à filets d'or",
      "material": "dark",
      "size": [512, 512],
      "display": "nine-patch",
      "transparent": true,
      "margins": {
        "left": 112,
        "top": 112,
        "right": 112,
        "bottom": 112
      },
      "tileMode": {
        "horizontal": "repeat",
        "vertical": "repeat"
      },
      "description": "Grand panneau laqué presque noir, double filet d'or, coins ornés de filigranes qui débordent vers l'extérieur. Porte les réglages, les crédits, la pause et le journal.",
      "prompt": "Large rectangular panel: near-black lacquered centre with a faint grain, framed by a double bright gold filet; each corner carries an ornate gold filigree bracket that slightly overhangs outward.",
      "mockups": [
        {
          "file": "05_Options_Mockup.png",
          "zone": [430, 110, 1430, 940],
          "shows": "panneau des réglages"
        },
        {
          "file": "05_Options_Mockup.png",
          "zone": [95, 65, 440, 890],
          "shows": "colonne des onglets"
        },
        {
          "file": "07_Credit_Mockup.png",
          "zone": [380, 170, 1290, 830],
          "shows": "panneau des crédits"
        }
      ],
      "screens": ["T3.2", "T3.3", "T3.9"],
      "fallback": ["panel", "panelEdge"]
    },
    {
      "key": "ui/frame/panel-parchment",
      "name": "Feuille de parchemin rivetée",
      "material": "parchment",
      "size": [768, 768],
      "display": "nine-patch",
      "transparent": true,
      "margins": {
        "left": 128,
        "top": 128,
        "right": 128,
        "bottom": 128
      },
      "tileMode": {
        "horizontal": "repeat",
        "vertical": "repeat"
      },
      "states": [
        {
          "id": "plain",
          "label": "simple",
          "prompt": "no binding"
        },
        {
          "id": "bound",
          "label": "reliée",
          "prompt": "a worn garnet leather binding strip runs along the whole left edge, inside the left margin"
        }
      ],